song_id,mood_vec,song_name,song_artists
3vv9phIu6Y1vX3jcqaGz5Z,[0.00597408 0.4835023  0.40498102 0.10554265],Roses, The Chainsmokers ROZES
2fTsFCKRFQ5M0igJgabnLA,[0.00101211 0.6094069  0.36012992 0.02945102],Price Tag, Jessie J B.o.B
2HSmyk2qMN8WQjuGhaQgCk,[0.02680397 0.17380063 0.20543747 0.5939579 ],Champagne Poetry, Drake
0u2P5u6lvoDfwTYjAADbn4,[0.06711572 0.01075564 0.02378542 0.89834315],lovely (with Khalid), Billie Eilish Khalid
6lzc0Al0zfZOIFsFvBS1ki,[0.00643028 0.43351105 0.40124777 0.15881082],State Of Grace (Taylor's Version), Taylor Swift
7s3VamLgN0rvQ0W0FlDST8,[0.05708986 0.03692441 0.06673121 0.8392545 ],Train Wreck, James Arthur
39glqzRVRAy4vq3PqeTGb8,[0.01727675 0.29643515 0.34178677 0.34450135],Love Is Gone, SLANDER Dylan Matthew
0heE5tAAaDQmnGhVDImPl2,[0.01980931 0.267477   0.31108645 0.40162727],Dynasty, MIIA
44n97yHySt0Z9rqPaXgjCK,[0.0656959  0.01281585 0.02871308 0.89277524],Sorry, Halsey
4nVBt6MZDDP6tRVdQTgxJg,[0.01599044 0.31471378 0.34233806 0.3269577 ],Story of My Life, One Direction
3umgWkMmr9yrPZTlzZJWz7,[0.02068352 0.33944747 0.359556   0.28031304],so sick of love, Sad Puppy Rafael G Izabel
4y4spB9m0Q6026KfkAvy9Q,[0.07795831 0.01607296 0.03431328 0.87165546],Lonely (with benny blanco), Justin Bieber benny blanco
3di5hcvxxciiqwMH1jarhY,[0.0073867  0.43021026 0.40814018 0.15426286],Set Fire to the Rain, Adele
2qV4oFPfGjIH4bg9L8mjkJ,[0.00541143 0.47384977 0.40451178 0.11622698],Good Die Young, Molly Kate Kestner
0OI7AFifLSoGzpb8bdBLLV,[0.00579862 0.4909989  0.4104179  0.0927846 ],"Home (with Machine Gun Kelly, X Ambassadors & Bebe Rexha)", Machine Gun Kelly X Ambassadors Bebe Rexha
4RVwu0g32PAqgUiJoXsdF8,[0.05369541 0.01454133 0.03192903 0.8998343 ],Happier Than Ever, Billie Eilish
19JT7Qed2VQJM5w1ntLEEj,[0.15182659 0.01552939 0.03423186 0.7984122 ],This Is What 21 Feels Like, Sophie Rose
52iLDrSoRtf9lcgFuLVfqE,[0.07236775 0.02687532 0.05386761 0.8468893 ],Older, Sasha Alex Sloan
5vjLSffimiIP26QG5WcN2K,[0.04152419 0.12487075 0.18134062 0.6522644 ],Hold On, Chord Overstreet
0GNI8K3VATWBABQFAzBAYe,[0.05723897 0.01109093 0.02449418 0.90717596],Stay, Rihanna Mikky Ekko
4WahOhXKxmMKVnfVXQoEtk,[0.00566984 0.49564534 0.40590826 0.09277657],Remedy, Ali Gatie
2CvOqDpQIMw69cCzWqr5yr,[0.01888057 0.29527533 0.33470798 0.35113618],Halo, Beyoncé
222B3aljXx6fFwKmFjuBED,[0.00628666 0.45634893 0.41154176 0.1258226 ],Woman Like Me (feat. Nicki Minaj), Little Mix Nicki Minaj
7a53HqqArd4b9NF4XAmlbI,[0.00505033 0.4864277  0.41203266 0.09648928],Kings & Queens, Ava Max
3hlksXnvbKogFdPbpO9vel,[0.0021396  0.5867598  0.36592555 0.045175  ],Super Bass, Nicki Minaj
2K87XMYnUMqLcX3zvtAF4G,[0.00586869 0.4573766  0.41102463 0.12573008],Drag Me Down, One Direction
1HNkqx9Ahdgi1Ixy2xkKkL,[0.04779726 0.05583338 0.09583601 0.80053335],Photograph, Ed Sheeran
08bNPGLD8AhKpnnERrAc6G,[0.00840819 0.4330646  0.39385542 0.16467178],FRIENDS, Marshmello Anne-Marie
1beqtQO0aIc1dWsXr97Iji,[0.0062685  0.46449625 0.38377532 0.14545992],Let You Go, Machine Gun Kelly
5oO3drDxtziYU2H1X23ZIp,[0.00647303 0.432285   0.39616668 0.16507523],Love On The Brain, Rihanna
1i1fxkWeaMmKEB4T7zqbzK,[0.00339    0.5246073  0.38927862 0.08272409],Don't Let Me Down, The Chainsmokers Daya
6mQLN3zRtAp6ovjusyYKrV,[0.00679606 0.46268666 0.3891981  0.1413192 ],Rewrite The Stars (with James Arthur & Anne-Marie), James Arthur Anne-Marie
1rIKgCH4H52lrvDcz50hS8,[0.00542221 0.47550175 0.4123821  0.10669394],Lush Life, Zara Larsson
3nc420PXjTdBV5TN0gCFkS,[0.03335901 0.13031204 0.17516387 0.66116506],Ocean (feat. Khalid), Martin Garrix Khalid
7I3U51Fv3SLSCqVqYlMi5X,[0.0041833  0.4942598  0.40134293 0.10021397],Louder, Neon Jungle
1bhUWB0zJMIKr9yVPrkEuI,[0.0505106  0.02569937 0.05049969 0.87329024],Perfect Duet (Ed Sheeran & Beyoncé), Ed Sheeran Beyoncé
0YammaEkYSeo9vQYZ1OwS6,[0.00484112 0.4912819  0.41305247 0.09082448],Say My Name, David Guetta Bebe Rexha J Balvin
1uXbwHHfgsXcUKfSZw5ZJ0,[0.00117793 0.6091778  0.3600274  0.02961673],Run the World (Girls), Beyoncé
6RUKPb4LETWmmr3iAEQktW,[0.00948066 0.4069133  0.40252987 0.18107618],Something Just Like This, The Chainsmokers Coldplay
0b11D9D0hMOYCIMN3OKreM,[0.00170933 0.5927173  0.3669569  0.03861651],Into Your Arms (feat. Ava Max), Witt Lowry Ava Max
2GyA33q5rti5IxkMQemRDH,[0.00391653 0.49994743 0.40970734 0.08642872],I Know What You Did Last Summer, Shawn Mendes Camila Cabello
5sra5UY6sD658OabHL3QtI,[0.05850645 0.02803858 0.05346983 0.8599851 ],Empire State of Mind (Part II) Broken Down, Alicia Keys
2afCBiru10AFckfOa49wIa,[0.02327159 0.2258611  0.29043454 0.4604327 ],You & I, One Direction
2ia7iiEtpiOL2ZVuWxBZGB,[0.01010392 0.38079917 0.3719551  0.23714179],I Will Never Let You Down, Rita Ora
0puf9yIluy9W0vpMEUoAnN,[0.00347928 0.5221663  0.38902184 0.08533259],Bang Bang, Jessie J Ariana Grande Nicki Minaj
49FYlytm3dAAraYgpoJZux,[0.00187108 0.5429829  0.39514855 0.05999749],Umbrella, Rihanna JAY-Z
0DC7Zs2qvAbNK1owWQ4mlL,[0.00463071 0.4791805  0.4031473  0.11304144],Perfect to Me, Anne-Marie
4btFHqumCO31GksfuBLLv3,[0.00098867 0.6030903  0.3644496  0.03147148],Overpass Graffiti, Ed Sheeran
58kZ9spgxmlEznXGu6FPdQ,[0.01308053 0.38361648 0.39896005 0.20434295],Sick Boy, The Chainsmokers
6M31fPFCYB8Job3MCjjrDV,[0.00819214 0.42415404 0.39351755 0.17413631],They Don't Know About Us, One Direction
4iLqG9SeJSnt0cSPICSjxv,[0.00632078 0.44758105 0.41912797 0.12697022],Attention, Charlie Puth
0azC730Exh71aQlOt9Zj3y,[0.00818282 0.41510728 0.3778613  0.19884865],This Is What You Came For (feat. Rihanna), Calvin Harris Rihanna
1rfofaqEpACxVEHIZBJe6W,[0.01602833 0.32568145 0.36132607 0.2969642 ],Havana (feat. Young Thug), Camila Cabello Young Thug
32DGGj6KlNuBr6WaqRxpxi,[0.00739519 0.43233714 0.41283625 0.14743136],How Long, Charlie Puth
79cuOz3SPQTuFrp8WgftAu,[0.00700063 0.43197158 0.39718804 0.1638398 ],There's Nothing Holdin' Me Back, Shawn Mendes
6EpRaXYhGOB3fj4V2uDkMJ,[0.01615716 0.3240411  0.36530057 0.2945012 ],Strip That Down, Liam Payne Quavo
2ekn2ttSfGqwhhate0LSR0,[0.00386696 0.5071012  0.41142294 0.07760894],New Rules, Dua Lipa
3A7qX2QjDlPnazUsRk5y0M,[0.00842343 0.4229014  0.3897922  0.1788829 ],2U (feat. Justin Bieber), David Guetta Justin Bieber
7qiZfU4dY1lWllzX7mPBI3,[0.01887578 0.25847512 0.30247593 0.4201731 ],Shape of You, Ed Sheeran
1x5sYLZiu9r5E43kMlt9f8,[0.01305722 0.35470492 0.3664458  0.26579198],Symphony (feat. Zara Larsson), Clean Bandit Zara Larsson
3hBBKuWJfxlIlnd9QFoC8k,[0.00866681 0.42524663 0.40764883 0.15843768],What Lovers Do (feat. SZA), Maroon 5 SZA
3m660poUr1chesgkkjQM7P,[0.0013041  0.6038959  0.36341706 0.03138296],Sorry Not Sorry, Demi Lovato
7nZmah2llfvLDiUjm0kiyz,[0.00356501 0.5270378  0.403622   0.06577515],Friends (with BloodPop®), Justin Bieber BloodPop®
5troof8mcGO3AafoDbk1gc,[0.00685671 0.45122933 0.40056756 0.14134642],Look What You Made Me Do, Taylor Swift
3AFfyUXTfj12PgrOkZiiJo,[0.002343   0.5585236  0.3895689  0.04956452],Treat You Better, Shawn Mendes
1louJpMmzEicAn7lzDalPW,[0.00423028 0.49529323 0.4130618  0.08741476],No Promises (feat. Demi Lovato), Cheat Codes Demi Lovato
5AEtlRudpgdT5FtNiuly6Y,[0.00469234 0.49097866 0.416168   0.08816104],"Let Me Go (with Alesso, Florida Georgia Line & watt)", Hailee Steinfeld Alesso Florida Georgia Line WATT
3DXncPQOG4VBw3QHh3S817,[0.00627785 0.4390456  0.415408   0.1392686 ],"I'm the One (feat. Justin Bieber, Quavo, Chance the Rapper & Lil Wayne)", DJ Khaled Justin Bieber Quavo Chance the Rapper Lil Wayne
0Qh38w01QRXK6KHIv0e3hb,[0.01306364 0.3503374  0.37408158 0.2625174 ],What About Us, P!nk
2xmrfQpmS2iJExTlklLoAL,[0.01863386 0.31129554 0.34603313 0.32403743],I Miss You (feat. Julia Michaels), Clean Bandit Julia Michaels
0KKkJNfGyhkQ5aFogxQAPU,[0.00351275 0.50010616 0.41434157 0.08203954],That's What I Like, Bruno Mars
1OAh8uOEOvTDqkKFsKksCi,[0.00519434 0.4771926  0.41622412 0.10138897],Wild Thoughts (feat. Rihanna & Bryson Tiller), DJ Khaled Rihanna Bryson Tiller
4c2W3VKsOFoIg2SFaO6DY5,[0.00481251 0.47067025 0.42116472 0.10335257],Your Song, Rita Ora
6kex4EBAj0WHXDKZMEJaaF,[0.00299063 0.53260136 0.4017612  0.06264681],Swalla (feat. Nicki Minaj & Ty Dolla $ign), Jason Derulo Nicki Minaj Ty Dolla $ign
1NDxZ7cFAo481dtYWdrUnR,[0.00575622 0.4585257  0.40283915 0.13287891],Pretty Girl - Cheat Codes X CADE Remix, Maggie Lindemann Cheat Codes CADE
3eR23VReFzcdmS7TYCrhCe,[0.01201396 0.3764124  0.39511913 0.21645455],It Ain't Me (with Selena Gomez), Kygo Selena Gomez
2kVHAQKVtczchKctctzbtK,[0.00449712 0.4807299  0.41496325 0.09980971],Swish Swish, Katy Perry Nicki Minaj
5CtI0qwDJkDQGwXD1H1cLb,[0.00591598 0.4639878  0.40712416 0.12297211],Despacito - Remix, Luis Fonsi Daddy Yankee Justin Bieber
7iDa6hUg2VgEL1o1HjmfBn,[0.00304196 0.5283377  0.40362957 0.06499071],Meant to Be (feat. Florida Georgia Line), Bebe Rexha Florida Georgia Line
3ebXMykcMXOcLeJ9xZ17XH,[0.01141913 0.390599   0.38366115 0.21432073],Scared to Be Lonely, Martin Garrix Dua Lipa
7EI6Iki24tBHAMxtb4xQN2,[0.00677325 0.4570512  0.40534943 0.13082609],Anywhere, Rita Ora
6520aj0B4FSKGVuKNsOCOi,[0.00222799 0.54531276 0.38676187 0.06569736],Chained To The Rhythm, Katy Perry Skip Marley
61WbtB6ujkpNAsAf5LjF4b,[0.0053287  0.48257512 0.4065644  0.10553176],Bon appétit, Katy Perry Migos
0Wv5wuenRLI3BcwgT3HPIP,[0.02260166 0.25292915 0.29004398 0.43442523],A Different Way (with Lauv), DJ Snake Lauv
76cy1WJvNGJTj78UqeA5zr,[0.00738431 0.44020015 0.4189544  0.1334611 ],IDGAF, Dua Lipa
0gbBzIqrECJOEPvQJIBFs5,[0.00673291 0.45279253 0.40654916 0.1339255 ],Green Light, Lorde
6Pw3Gvw4wNMZfTYZa6IQal,[0.00277556 0.539114   0.39215747 0.06595301],The Way I Are (Dance with Somebody) (feat. Lil Wayne) - Spotify Version, Bebe Rexha Lil Wayne
2z4pcBLQXF2BXKFvd0BuB6,[0.00451895 0.49792817 0.41404176 0.08351114],Tip Toe (feat. French Montana), Jason Derulo French Montana
5Htb1uFQ1KrkFXlefS8oGj,[0.0130313  0.37986812 0.390822   0.21627855],Tell Me You Love Me, Demi Lovato
02gj0J38nzyO9lNi9mzi3A,[0.00087167 0.6220703  0.35147917 0.02557887],Power (feat. Stormzy), Little Mix Stormzy
1NXDq5UBby80GsRNjGXVwE,[0.00389241 0.50910723 0.40577376 0.08122665],No More Sad Songs (feat. Machine Gun Kelly), Little Mix Machine Gun Kelly
6W6ijKiufUsBBcgJPKis6T,[0.00284461 0.5323759  0.40203556 0.06274397],Is Your Love Enough?, Little Mix
3EfugazgSddQvzZpkof5I4,[0.00535326 0.4878782  0.40103456 0.10573394],Ciao Adios, Anne-Marie
2vHDurkzJ8dhCzoPzqiE2C,[0.00705583 0.44641665 0.4112136  0.13531394],Por Favor - Spanglish Version, Fifth Harmony Pitbull
05KfyCEE6otdlT1pp2VIjP,[0.00218679 0.5596595  0.38914943 0.04900433],Believer, Imagine Dragons
7BKLCZ1jbUBVqRi2FVlTVw,[0.0238603  0.22365536 0.28410548 0.46837878],Closer, The Chainsmokers Halsey
23L5CiUhw2jV1OIMwthR3S,[0.01191919 0.40191445 0.3779213  0.20824501],In the Name of Love, Martin Garrix Bebe Rexha
4tCtwWceOPWzenK2HAIJSb,[0.00895529 0.40991503 0.41029918 0.1708305 ],Work from Home (feat. Ty Dolla $ign), Fifth Harmony Ty Dolla $ign
6uBhi9gBXWjanegOb2Phh0,[0.01400966 0.35215375 0.37195924 0.26187736],Stay, Zedd Alessia Cara
0lYBSQXN6rCTvUZvg9S0lU,[0.01315455 0.38207954 0.38429677 0.22046919],Let Me Love You, DJ Snake Justin Bieber
7MXVkk9YMctZqd1Srtv4MB,[0.00256672 0.5397997  0.39281213 0.06482141],Starboy, The Weeknd Daft Punk
12GEpg2XOPyqk03JZEZnJs,[0.01201396 0.3764124  0.39511913 0.21645455],It Ain’t Me (with Selena Gomez), Kygo Selena Gomez
5knuzwU65gJK7IF5yJsuaW,[0.01323684 0.33860576 0.35213175 0.29602566],Rockabye (feat. Sean Paul & Anne-Marie), Clean Bandit Sean Paul Anne-Marie
2Z8WuEywRWYTKe1NybPQEW,[0.00728166 0.44977555 0.41949517 0.12344764],Ride, Twenty One Pilots
1pKeFVVUOPjFsOABub0OaV,[0.00148921 0.58525896 0.37517712 0.03807474],Side To Side, Ariana Grande Nicki Minaj
7xoUc6faLbCqZO6fQEYprd,[0.01502595 0.3474321  0.36785886 0.26968306],One Last Time, Ariana Grande
4Ce37cRWvM1vIGGynKcs22,[0.0204541 0.2916429 0.3300022 0.3579008],Starving, Hailee Steinfeld Grey Zedd
762UXiwEHYY97VL45sAUPR,[0.00851086 0.42133597 0.38918108 0.18097205],2U, David Guetta Justin Bieber
0prNGof3XqfTvNDxHonvdK,[0.00547946 0.48003414 0.41106915 0.10341733],Scars To Your Beautiful, Alessia Cara
37FXw5QGFN7uwwsLy8uAc0,[0.03620429 0.15774393 0.2066742  0.5993776 ],We Don't Talk Anymore (feat. Selena Gomez), Charlie Puth Selena Gomez
7DoN0sCGIT9IcLrtBDm4f0,[0.01430288 0.3715867  0.3808948  0.23321557],Lonely Together (feat. Rita Ora), Avicii Rita Ora
6b8Be6ljOzmkOmFslEb23P,[0.00328596 0.51952314 0.40714785 0.07004305],24K Magic, Bruno Mars
2SZy40PLDk3vFucXUGFCFA,[0.00437462 0.49453264 0.4082947  0.09279799],You Don't Know Me, Jax Jones RAYE
53B2XmmjJ9rriW1qciMBeX,[0.00210217 0.5779695  0.37879372 0.04113458],Treat You Better, Shawn Mendes
5m709dCjbKSbA9eBAuyu0P,[0.01534539 0.36926302 0.38733387 0.22805773],Why, Andra
4trx1lgbQ9FtrI5V9Y8C5Y,[0.00184824 0.5851545  0.3747489  0.03824837],I Wish (feat. T.I.), Cher Lloyd T.I.
1j4kHkkpqZRBwE0A4CN4Yv,[0.01729885 0.2907547  0.32955652 0.3623899 ],Dusk Till Dawn - Radio Edit, ZAYN Sia
7F9vK8hNFMml4GtHsaXui6,[0.00881927 0.45071217 0.40313807 0.1373305 ],Back to You (feat. Bebe Rexha & Digital Farm Animals), Louis Tomlinson Bebe Rexha Digital Farm Animals
5yFSF6qQA1rcLsQRnBsZgb,[0.01087177 0.40751368 0.3832688  0.19834577],All Falls Down (feat. Juliander), Alan Walker Noah Cyrus Digital Farm Animals Juliander
26gceVsA1ybT8qsX3aYLEn,[0.0047926  0.48366386 0.39572537 0.11581812],Thunder, Imagine Dragons
2mfUa8bLs2s5N4VaqJZ4lZ,[0.00852869 0.43140793 0.41433984 0.1457236 ],Most Girls, Hailee Steinfeld
2zDt2TfQbxiSPjTVJTgbwz,[0.01964216 0.3008397  0.33306998 0.34644818],Starving, Hailee Steinfeld Grey Zedd
5kofSEc4sxfuss9ukfSw9L,[0.0012174  0.60178936 0.36495277 0.03204044],You're Such A, Hailee Steinfeld
52izjvF7wwveRG1rDJsGWe,[0.00413233 0.5202677  0.39802003 0.07757997],Love Myself, Hailee Steinfeld
16geeCnXrbiomV1IZ8Kudc,[0.00775622 0.44183612 0.4081073  0.14230031],"Back to Life - from ""Bumblebee""", Hailee Steinfeld
7Coulic7di20MlW1bEytkQ,[0.00487862 0.50374085 0.3923795  0.09900109],Dreamer - Compound Version, Charli XCX Starrah RAYE
1YNQscOx6OqBQjxgJVhEeW,[0.007287   0.4450798  0.41291484 0.13471828],"Girls (feat. Cardi B, Bebe Rexha & Charli XCX)", Rita Ora Bebe Rexha Charli XCX Cardi B
1ny60YCHhEsxsJXWLhK7b0,[0.00738431 0.44020015 0.4189544  0.1334611 ],IDGAF, Dua Lipa
7ef4DlsgrMEH11cDZd32M6,[0.00253646 0.5396925  0.39896592 0.05880503],One Kiss (with Dua Lipa), Calvin Harris Dua Lipa
6tHWl8ows5JOZq9Yfaqn3M,[0.00177024 0.5875281  0.37337545 0.03732623],Mine, Bazzi
4VUwkH455At9kENOfzTqmF,[0.02499455 0.26227686 0.3036843  0.40904433],Beautiful (feat. Camila Cabello), Bazzi Camila Cabello
7wrDRQgHlvDnimrRHfQZxt,[0.02790971 0.17874753 0.22722913 0.5661137 ],Psycho (feat. Ty Dolla $ign), Post Malone Ty Dolla $ign
3pIigjAWkzwAonXpJ1fmSF,[0.00311343 0.5286718  0.39649722 0.07171754],Everybody Hates Me, The Chainsmokers
5BgsAQnzQFlunJY5T4k1Pd,[0.01008542 0.39010695 0.3891379  0.21066971],Put Me Back Together (feat. Kiiara), Cheat Codes Kiiara
54VhMO14MfyB9I9IUtjR6p,[0.02834856 0.26183763 0.33252662 0.37728715],The Wave, R3HAB Lia Marie Johnson
0VgkVdmE4gld66l8iyGjgx,[0.00428601 0.56539285 0.39895672 0.0313645 ],Mask Off, Future
3WRFoIQqOML60XfxFbAXTp,[0.00124051 0.58146197 0.3778919  0.03940563],Dirty Sexy Money (feat. Charli XCX & French Montana) - Joe Stone Remix, David Guetta Afrojack Charli XCX French Montana Joe Stone
60zCXVn6QyD4TddmlvnXYw,[0.00742891 0.41965663 0.39025474 0.18265973],Rock Bottom, Hailee Steinfeld DNCE
0m6TrXRLlNFLkOGiW38kDf,[0.00497811 0.48862702 0.4111014  0.0952935 ],Capital Letters, Hailee Steinfeld BloodPop®
1CSk9lJFJt4OdcvOH5iK61,[0.00370931 0.51314765 0.4027915  0.08035158],I Miss You (feat. Julia Michaels) - Cahill Remix, Clean Bandit Julia Michaels Cahill
2BNkTvg1kHAAfGvqh56x5a,[0.03355141 0.17581917 0.2393092  0.5513202 ],Getting Over You, Lauv
5HwnezK198pJCEj1l2Adjy,[0.006188   0.47188342 0.40943927 0.11248937],She Loves Control, Camila Cabello
52okn5MNA47tk87PeZJLEL,[0.00886959 0.41375655 0.377902   0.19947183],Let You Down, NF
1tndktY8ZFXapGYIeHUGR2,[0.00716639 0.42948148 0.38617626 0.17717592],There x2, Slushii Marshmello
6GW4n7EdAV9w8YpAgtJnuc,[0.00217327 0.57739794 0.37316245 0.04726634],Worry No More (feat. Lil Yachty & Santigold), Diplo Lil Yachty Santigold
7gHs73wELdeycvS48JfIos,[0.0140988  0.37057802 0.38616624 0.22915697],Faded, Alan Walker
1snWlbcbgQpJfknoI30DWG,[0.01250728 0.35038278 0.3527968  0.28431317],Darkside, Alan Walker Au/Ra Tomine Harket
2DGa7iaidT5s0qnINlwMjJ,[0.00868889 0.43133143 0.40460497 0.1553747 ],The Spectre, Alan Walker
1jLsirPDkUS2g4gnkYua58,[0.0035991  0.52695656 0.40331787 0.06612645],Ignite, Alan Walker Julie Bergan K-391 SEUNGRI
1ynVxkQjPcDRlJwYkApoNy,[0.0069659  0.45008013 0.40142426 0.1415296 ],Different World (feat. CORSAK), Alan Walker K-391 Sofia Carson CORSAK
7kVDkZkZc8qBUBsF6klUoY,[0.00225021 0.5728568  0.37886837 0.04602456],I Don't Wanna Go, Alan Walker Julie Bergan
4J4zx8xGJpuGndrVc06KaT,[0.01154555 0.42212176 0.38026518 0.18606758],Diamond Heart, Alan Walker Sophia Somajo
0lG6QM1jjbbX5UUn3DPmrZ,[0.01071411 0.398273   0.40326497 0.18774797],Lost Control, Alan Walker Sorana
5GDpODnukzZZIXXjPWOrDQ,[0.05047451 0.2945744  0.3401974  0.31475365],Sky, Alan Walker Alex Skrindo
0lks2Kt9veMOFEAPN0fsqN,[0.00970843 0.40120655 0.38196737 0.20711757],Lily, Alan Walker K-391 Emelie Hollow
6HMT7AzGA5wmn5m2t1BuZR,[0.01061995 0.41647297 0.40137362 0.17153344],Lonely (feat. ISÁK & Omar Noir), Alan Walker Steve Aoki ISÁK Omar Noir
1xUZ6CgfpXspcQuEIOhf2v,[0.01325761 0.38864794 0.39689344 0.20120099],Do It All for You, Alan Walker Trevor Guthrie
4n7jnSxVLd8QioibtTDBDq,[0.0034596  0.5251046  0.39290628 0.07852957],On My Way, Alan Walker Sabrina Carpenter Farruko
3b5Li4QKDVBx1x7fQuu54a,[0.0035918  0.51878214 0.40331647 0.07430957],Tired, Alan Walker Gavin James
0JiVRyTJcJnmlwCZ854K4p,[0.01178236 0.4140864  0.38317615 0.19095509],Alone, Alan Walker
2Fjz5ZC5BvFdCqcnTZ3ilH,[0.00562392 0.47971997 0.39724192 0.11741412],Sing Me to Sleep, Alan Walker
0Kk8NWt2aj8OXeYONMzxrk,[0.00388499 0.5205497  0.40259513 0.07297013],Again (feat. XXXTENTACION) - Alan Walker Remix, Noah Cyrus XXXTENTACION Alan Walker
0kiYDq0MKIhDXLWPgUvrUr,[0.00289266 0.567418   0.37044585 0.05924354],Legends Never Die (Alan Walker Remix), League of Legends Alan Walker Against The Current Mako
71bBFbfn2OBK5QwUJSLS44,[0.00449222 0.49822792 0.4072844  0.08999538],More Than You Know, Axwell /\ Ingrosso
7hvxMYq9JW5W0vFwiu1Zdr,[0.00321149 0.5183677  0.40312192 0.07529886],Dreamer, Axwell /\ Ingrosso
0T3Wt63oKZDsYPV2eL5Rjy,[0.00688001 0.43010232 0.39365658 0.1693611 ],Sun Is Shining, Axwell /\ Ingrosso
6VkrwNYiwqcf1HPNC7EErd,[0.00489103 0.47691053 0.40280026 0.11539821],Something New, Axwell /\ Ingrosso
6nE4EaCEfxNbs12TfIk7ic,[0.00609094 0.4527028  0.39849526 0.14271107],On My Way, Axwell /\ Ingrosso
3w9mof4ZxG3z9huYwHFZ1i,[0.01517778 0.36201695 0.40242636 0.22037894],That's It (feat. Gucci Mane & 2 Chainz), Bebe Rexha Gucci Mane 2 Chainz
2CBtDxdTSz3MP8yUnA4Xkh,[0.00780829 0.4178304  0.40633422 0.16802709],I Got Time, Bebe Rexha
3ZkUWF1MVm3tLgz7dplGpk,[0.00277556 0.539114   0.39215747 0.06595301],The Way I Are (Dance with Somebody) [feat. Lil Wayne], Bebe Rexha Lil Wayne
22BH6K8RlpwNzIINvWS4Jj,[0.0031626  0.54294455 0.39664882 0.05724399],(Not) The One, Bebe Rexha
1t1xXsK199Yte7oJbE7Uoe,[0.01997719 0.30608985 0.33432862 0.33960435],Comfortable (feat. Kranium), Bebe Rexha Kranium
45OALDywAY1JVLqI8eKF9y,[0.0074514  0.45191282 0.4038493  0.13678655],Atmosphere, Bebe Rexha
6DOBk1Pxe7q8YFI9Ozbrb3,[0.0067061  0.46855816 0.4068603  0.11787548],I Got You, Bebe Rexha
1rKqsfuQVUFhROVwcoGJGY,[0.01922904 0.30857614 0.3508273  0.32136747],Small Doses, Bebe Rexha
0xLCa6dp0wmDUhkDGKzDpv,[0.00601019 0.47787112 0.41478375 0.10133492],F.F.F. (feat. G-Eazy), Bebe Rexha G-Eazy
51BroelKJaagm8GOIVFv3f,[0.00646459 0.45878747 0.4113315  0.12341639],Gateway Drug, Bebe Rexha
4ZJPwET9Jrgpkqi4Vo3Yg8,[0.00591582 0.4703888  0.4072411  0.11645427],Bad Bitch (feat. Ty Dolla $ign), Bebe Rexha Ty Dolla $ign
4qULqxfCRhJAXVc75UupQB,[0.00456086 0.4720992  0.41396385 0.10937603],No Broken Hearts (feat. Nicki Minaj), Bebe Rexha Nicki Minaj
41dykwc7XRMk44xgg8hykQ,[0.01485513 0.3581003  0.39563307 0.2314115 ],Ferrari, Bebe Rexha
18oGgOeVdawfYCWndM3Tl6,[0.00902678 0.43420762 0.4013239  0.15544164],2 Souls on Fire (feat. Quavo), Bebe Rexha Quavo
3BT6pJdmvpsjCHsbZg9fzF,[0.0112012  0.40501848 0.40354618 0.18023418],I'm a Mess, Bebe Rexha
0XbAySkD2xUPUudQ1a0kGc,[0.01478829 0.3652842  0.3830757  0.23685177],Steady (feat. Tory Lanez), Bebe Rexha Tory Lanez
0i0wnv9UoFdZ5MfuFGQzMy,[0.0182982  0.34372953 0.3719869  0.26598546],Last Hurrah, Bebe Rexha
6VpQdig9pdpTSIFItgkJV5,[0.00968704 0.401459   0.3835183  0.2053357 ],Never Be the Same, Camila Cabello
4V6MRo0CEAC9MwAm7dkPuL,[0.04557173 0.06764203 0.11302893 0.77375734],Real Friends, Camila Cabello
4xBjsLUSjcx2h7PcRikpQp,[0.01116303 0.372312   0.37792617 0.23859876],OMG (feat. Quavo), Camila Cabello Quavo
6BKeNWeUqxmvQ09Gxd3ZGX,[0.0052065  0.4793162  0.4028091  0.11266819],Know No Better, Major Lazer Travis Scott Camila Cabello Quavo
3NgCzSW98SsqBdpYcnm4kv,[0.01838384 0.34635186 0.3483283  0.28693599],I Have Questions, Camila Cabello
1SJtlNRJDeYHioymcvsqev,[0.00761685 0.46678272 0.39108637 0.13451412],Crying in the Club, Camila Cabello
7IL3UOlcJ6nmcCMwpnlfcA,[0.04051392 0.1263271  0.18452322 0.6486358 ],Something's Gotta Give, Camila Cabello
72jbDTw1piOOj770jWNeaG,[0.01184722 0.38877574 0.39628395 0.20309304],Paris, The Chainsmokers
1KeZgPUr54C8iz3FjqzVoz,[0.00932403 0.41206738 0.40940484 0.16920376],Young, The Chainsmokers
4BiiOzZCrXEzHRLYcYFiD5,[0.02209593 0.27774256 0.3140451  0.38611636],Hope, The Chainsmokers Winona Oak
0B8B8cVRFIG1yznoQe7c9s,[0.00521795 0.4775494  0.4111275  0.10610519],Setting Fires, The Chainsmokers XYLØ
0w75KG0DuLDi6tdHmEMovD,[0.00334037 0.5293314  0.38606143 0.08126681],Don't Let Me Down, The Chainsmokers Daya
65Qe0x9oCbs9pNJc6QBFx7,[0.01625228 0.35608876 0.38706186 0.24059714],All We Know, The Chainsmokers Phoebe Ryan
2QvDlXN2SZpuRm0hrIPjFd,[0.02794808 0.2519184  0.315995   0.40413857],You Owe Me, The Chainsmokers
3pWcj8hxj3fsb9TDAcMpEl,[0.0200974  0.29465583 0.33922604 0.34602076],Somebody, The Chainsmokers Drew Love
2khkbmL11VFqKGMrcGIJB3,[0.00616822 0.45629835 0.40860495 0.1289285 ],Out of My Head (feat. Tove Lo and ALMA), Charli XCX Tove Lo ALMA
05mAIVLkIWc2d1UBYZBCp8,[0.00337567 0.52058375 0.40660447 0.06943616],1999, Charli XCX Troye Sivan
0y8Wf6ltWpGCpgqVa21QNX,[0.00430931 0.5120505  0.4004341  0.08320606],After the Afterparty (feat. Lil Yachty), Charli XCX Lil Yachty
094RugjgLW6CdPLOJctBZ3,[0.00508645 0.5013433  0.40134346 0.09222675],Boom Clap, Charli XCX
5o4yGlG0PfeVUa6ClIyOxq,[0.00586663 0.4610878  0.41757768 0.1154679 ],Boys, Charli XCX
70ebKSMHvkUSg7JXgUz74Q,[0.00225284 0.54603267 0.39620128 0.05551319],Break the Rules, Charli XCX
1eyrmeiDpdTkOmA839nPVQ,[0.00440482 0.5082711  0.4001701  0.08715397],Shed a Light, Robin Schulz David Guetta Cheat Codes
1MyWtH2yavuP1AHUi1X7ur,[0.00644511 0.47075355 0.40615323 0.11664805],Sex, Cheat Codes Kris Kross Amsterdam
0SiywuOBRcynK0uKGWdCnn,[0.00268922 0.51415694 0.40839493 0.07475887],Bad Romance, Lady Gaga
4JehYebiI9JE8sR8MisGVb,[0.01947955 0.28540155 0.32982418 0.36529467],Halo, Beyoncé
64yrDBpcdwEdNY9loyEGbX,[0.00392662 0.50126773 0.38178784 0.1130179 ],21 Guns, Green Day
5x5JM1BSB6vollcIzDocqT,[0.00945932 0.38957167 0.38209906 0.21886986],The Climb, Miley Cyrus
7jk7gqyEonmVVYahZN5zhW,[0.00545151 0.46792963 0.41491765 0.11170124],Circus, Britney Spears
5XRHGXut00SrJUFmcn2lQF,[0.00476617 0.4830312  0.38612312 0.12607947],All The Right Moves, OneRepublic
3oDFtOhcN08qeDPAK6MEQG,[0.00536604 0.4695739  0.40127057 0.12378953],Boom Boom Pow, Black Eyed Peas
0CINJz55gaKzuAsqhZ0hEU,[0.0032039  0.5186188  0.40521738 0.07295991],Waking Up In Vegas, Katy Perry
3DamFFqW32WihKkTVlwTYQ,[0.00440215 0.475087   0.40548235 0.11502854],Fireflies, Owl City
0eH2eHURaXUP15D8gQlfjx,[0.00276448 0.5434737  0.3968452  0.05691661],LoveGame, Lady Gaga
6Wx88Mv6b9ofjKMKkdwOJd,[0.00601542 0.44926208 0.40281636 0.1419062 ],New Divide, Linkin Park
4kLLWz7srcuLKA7Et40PQR,[0.0036061  0.5119384  0.39698392 0.08747155],I Gotta Feeling, Black Eyed Peas
0wruS6JEQCGeYrvsCIdG0Z,[0.00197885 0.5887679  0.36764908 0.04160424],Right Round (feat. Ke$ha), Flo Rida Kesha
3rMsX63C0IZVnOT5LGYoTH,[0.01904528 0.31590384 0.364043   0.3010079 ],Russian Roulette, Rihanna
02XnQdf7sipaKBBHixz3Zp,[0.00876576 0.41829783 0.3995251  0.17341134],Paparazzi, Lady Gaga
0juMU08O9byWiRBtKM1j5E,[0.03447329 0.17814267 0.23467448 0.5527095 ],Circle of Life/Nants' Ingonyama, Lindiwe Mkhize Lebo M.
04ZTP5KsCypmtCmQg5tH9R,[0.0112012  0.40501848 0.40354618 0.18023418],I'm a Mess, Bebe Rexha
25sgk305KZfyuqVBQIahim,[0.00423966 0.49593017 0.41041934 0.08941086],Sweet but Psycho, Ava Max
2aIRGUqHrX1cIEMSC2DFbr,[0.01262504 0.3557011  0.3593855  0.27228838],ואולי, Shlomo Artzi
5YScXJKtefsgdskIy60N7A,[0.00167834 0.5672061  0.37423912 0.05687642],Tubthumping, Chumbawamba
7aSvPfoqiM0zwPqupLGaHd,[0.00819668 0.41550505 0.40452212 0.17177615],BOY, Charlie Puth
2xsqrpB5uKX0wNbsv4UFwt,[0.00374087 0.5145976  0.40865767 0.07300387],אה אה אה, Efrat Gosh
6s3GEN8wK0OMzzzZbXj0fu,[0.00520382 0.4846147  0.40837118 0.1018103 ],Hymn for the Weekend - Seeb Remix, Coldplay Seeb
1CkvWZme3pRgbzaxZnTl5X,[0.00892693 0.4098858  0.4008963  0.18029094],Rolling in the Deep, Adele
5ghIJDpPoe3CfHMGu71E6T,[0.00291289 0.5100994  0.40738887 0.07959884],Smells Like Teen Spirit, Nirvana
0Ov4x4mro5sTaBlzlDuXYg,[0.00418449 0.5092167  0.3986502  0.08794857],I Am Above, In Flames
2kDH08boXJyhKMl5hnZbrE,[0.01764052 0.3010974  0.35458308 0.32667905],Love of a Lifetime, Firehouse
1CwNogTShsnsn1C8UhRmYX,[0.00964349 0.41589034 0.40714216 0.16732407],Rise, Katy Perry
4dASQiO1Eoo3RJvt74FtXB,[0.00101264 0.6272697  0.34280095 0.02891669],"Sucker for Pain (with Wiz Khalifa, Imagine Dragons, Logic & Ty Dolla $ign feat. X Ambassadors)", Lil Wayne Wiz Khalifa Imagine Dragons X Ambassadors Logic Ty Dolla $ign
