song_id,mood_vec,song_name,song_artists
1Xi84slp6FryDSCbzq4UCD,[0.07545711 0.02214683 0.04539378 0.85700226],Arcade, Duncan Laurence
0fioLzGM8ngbD1w6fMmm45,[0.04094923 0.09941502 0.15227164 0.7073641 ],I'm Not The Only One, Sam Smith
3U4isOIWM3VvDubwSI3y7a,[0.04669914 0.01281654 0.02738558 0.91309875],All of Me, John Legend
6OEHjJJvdkk1Ln0p0AZdyz,[0.05033542 0.09807003 0.1519588  0.6996358 ],Girls Like You, Maroon 5
3FAJ6O0NOHQV8Mc5Ri6ENp,[0.03732258 0.17711018 0.23183161 0.5537356 ],Heartbreak Anniversary, Giveon
2TIlqbIneP0ZY1O0EzYLlc,[0.04856167 0.05300164 0.08941565 0.80902106],Someone You Loved, Lewis Capaldi
50Td3qilgs8BLtv8mHyT1t,[0.0455479  0.05567446 0.09068035 0.80809736],Control, Zoe Wees
4rVW6XqAsSaf5vOwc8FREW,[0.01568958 0.3734634  0.3946096  0.21623747],Wild (feat. Gary Clark Jr.), John Legend Gary Clark Jr.
7yFhA2fUsL2oIMWlw5DaHQ,[0.02908592 0.24139321 0.30182642 0.42769447],The Bones, Maren Morris
7FsAFw1oZeTJUZmIzSh0cg,[0.03530724 0.16402332 0.21256547 0.58810395],Underdog, Alicia Keys
6Up545NUflOiXo8cEraH49,[0.03586186 0.0591538  0.09199227 0.81299204],You Say, Lauren Daigle
1koJk8rrMBlhDZ8MNiLzH9,[0.01502084 0.37324148 0.3475273  0.26421046],Always Remember Us This Way, Lady Gaga
6FZDfxM3a3UCqtzo5pxSLZ,[0.0152136  0.3239847  0.35693178 0.3038699 ],Without Me, Halsey
1HNywa8Bk0TmzRwQrzhtPo,[0.03263949 0.07043006 0.10994277 0.7869876 ],I Guess I Just Feel Like, John Mayer
2JtSnwYNKOphDrshYL8n4p,[0.01486508 0.35050634 0.3755966  0.25903198],I'm Like A Bird - Recorded at Spotify Studios NYC, Alessia Cara
15xWRPHQMeqgdkGzInx3PY,[0.06193582 0.03097988 0.05543811 0.85164624],Falling Like The Stars, James Arthur
7evPpWWu01Klxi0KlPxR17,[0.00686052 0.44312298 0.39629123 0.15372527],Mercy, Shawn Mendes
6QfS2wq5sSC1xAJCQsTSlj,[0.04269928 0.10957579 0.16878924 0.6789357 ],Shallow - Radio Edit, Lady Gaga Bradley Cooper
6700Z4Izi8EbB6JNthU6Ma,[0.03681341 0.14575201 0.20102598 0.61640865],Hold Me While You Wait, Lewis Capaldi
6UjZ2Yx2g2a52XxiA8ONxZ,[0.00913613 0.3982072  0.37175485 0.22090182],Outnumbered, Dermot Kennedy
09IStsImFySgyp0pIQdqAc,[0.01089752 0.3965225  0.39128795 0.20129205],The Middle, Zedd Maren Morris Grey
6Tio0ZoDeSQnI7EBAqWer2,[0.0059276  0.47747907 0.40597856 0.11061478],Cover Me In Sunshine, P!nk Willow Sage Hart
0tV8pOpiNsKqUys0ilUcXz,[0.04933658 0.0252007  0.0466033  0.87885934],Rise Up, Andra Day
4Y5gx8VuShNmakYGlnrUzD,[0.1060048  0.02496522 0.04686353 0.82216656],Surrender, Natalie Taylor
1N7YeVU0ZwAFbOhwM61ef6,[0.00681378 0.44945142 0.4047243  0.1390105 ],Head Above Water, Avril Lavigne
0Ult84lvFuqNvbyXwyRQ58,[0.02155608 0.28312355 0.3284483  0.366872  ],I Miss You (feat. Julia Michaels), Clean Bandit Julia Michaels
6jfEZdUJ2Yla6h7gTJgKuo,[0.01316028 0.3870402  0.40371498 0.19608456],Walk Me Home, P!nk
7LyBwug9tJgbaEzRCqtY78,[0.04734363 0.05444244 0.09118379 0.80703026],Put A Little Love On Me, Niall Horan
7oAraczbemGSNWqnbkU87R,[0.04585514 0.09857501 0.1510305  0.7045393 ],Too Good At Goodbyes, Sam Smith
4l0Mvzj72xxOpRrp6h8nHi,[0.05396393 0.06711575 0.10948135 0.7694389 ],Lose You To Love Me, Selena Gomez
22eqegdVyWgAQAwLkm7L9b,[0.01434867 0.350828   0.377303   0.25752038],September, James Arthur
5A6BJLZArq1MPjsnmcuk5f,[0.01314146 0.36862016 0.40285358 0.21538481],Lights Down Low, MAX
21jGcNKet2qwijlDFuPiPb,[0.0083809  0.41501775 0.39355063 0.18305063],Circles, Post Malone
2e9N4vHYVUwSwRorBzsZXE,[0.0042061  0.50704455 0.4110917  0.07765767],Almost (Sweet Music), Hozier
1wjzFQodRWrPcQ0AnYnvQ9,[0.02606612 0.26158556 0.30045837 0.41188985],I Like Me Better, Lauv
18k8IlS52uxRWObykDUZFG,[0.03473039 0.15478076 0.20963779 0.60085106],The Joke, Brandi Carlile
6sy3LkhNFjJWlaeSMNwQ62,[0.00689379 0.43214986 0.4038106  0.15714574],Counting Stars, OneRepublic
3CKCZ9pfwAfoMZlMncA1Nc,[0.00686947 0.43959883 0.40968147 0.14385022],Set Fire to the Rain, Adele
6UnCGAEmrbGIOSmGRZQ1M2,[0.01662093 0.32152334 0.35705063 0.3048051 ],Light On, Maggie Rogers
1rpDLMm4FjGqMz6N1dZZo8,[0.03933705 0.11646824 0.16940773 0.674787  ],Million Reasons, Lady Gaga
42fw0rxRO2xbesF6mJfd4Y,[0.01140236 0.3981793  0.40609953 0.18431889],Tequila, Dan + Shay
7lidXGPXPYLNThITAOTlkK,[0.01599732 0.33650762 0.36713892 0.28035614],You should be sad, Halsey
2sX7lJXsOYGP1Us6CqM9t1,[0.00674342 0.44218534 0.41122806 0.13984314],Little Bit of Love, Tom Grennan
3LlAyCYU26dvFZBDUIMb7a,[0.01233212 0.40390763 0.38292468 0.20083559],Demons, Imagine Dragons
4h0zU3O9R5xzuTmNO7dNDU,[0.06492011 0.00892651 0.02208169 0.90407175],Lost Boy, Ruth B.
0zbzrhfVS9S2TszW3wLQZ7,[0.01173439 0.38750383 0.3987796  0.20198224],September Song, JP Cooper
716eVtciaJCtTcaknS3QXr,[0.01395686 0.36465874 0.39011925 0.2312651 ],imagine, Ben Platt
5HBDBBr5OV90lubqW8ctJF,[0.01798547 0.34176922 0.38095242 0.2592929 ],if we never met, John K
1NrJYpdAi7uosDRPmSYrsG,[0.01787367 0.3007359  0.33143395 0.3499565 ],Apologize, OneRepublic
7DFNE7NO0raLIUbgzY2rzm,[0.03853858 0.1450783  0.2051255  0.61125755],Let Her Go, Passenger
3JvrhDOgAt6p7K8mDyZwRd,[0.02442251 0.25089365 0.29360932 0.4310746 ],Riptide, Vance Joy
6lfxq3CG4xtTiEg7opyCyx,[0.28504762 0.01573896 0.0329075  0.66630596],Can't Help Falling In Love, Kina Grannis
3V0nnQhqvbE3JmiDdnzQFQ,[0.07452952 0.02363677 0.04852042 0.8533134 ],July (feat. Leon Bridges), Noah Cyrus Leon Bridges
5f1joOtoMeyppIcJGZQvqJ,[0.01085207 0.41862988 0.41077858 0.1597394 ],Be Like That - feat. Swae Lee & Khalid, Kane Brown Swae Lee Khalid
4WzhjxvLP95y7AMDy0Atwb,[0.06143161 0.02355956 0.04579007 0.86921877],Out Of Love, Alessia Cara
4qug3gWrzeTNm0GhOkugJV,[0.03776239 0.13665782 0.18117015 0.64440966],Love Yourself, Justin Bieber
3GJ4hzg4lrGwU51Y3VARbF,[0.02317265 0.23725624 0.2851888  0.4543823 ],Speechless, Dan + Shay
5ELRkzdzz0HvGpMDlfZHkV,[0.01239186 0.32057488 0.35385615 0.31317708],Sign of the Times, Harry Styles
2iuZJX9X9P0GKaE93xcPjk,[0.00346678 0.50267047 0.41348234 0.08038043],Sugar, Maroon 5
4kflIGfjdZJW4ot2ioixTB,[0.04261408 0.01673904 0.03405938 0.9065876 ],Someone Like You, Adele
0aOluBqXYd0rFSCsgDyAWX,[0.03017039 0.1311653  0.17636795 0.66229635],Take Me to Church, Hozier
2BOqDYLOJBiMOXShCV1neZ,[0.05186482 0.01515578 0.03280486 0.9001745 ],Dancing On My Own, Calum Scott
4xqrdfXkTW4T0RauPLv3WA,[0.04837149 0.09043209 0.13472152 0.7264748 ],Heather, Conan Gray
1Omt5bfz1tZUCqd26HxbS0,[0.02091194 0.30048344 0.33494145 0.3436632 ],Beyond, Leon Bridges
11WbNwwAdoxfwpZxSHIP7J,[0.07226431 0.0142009  0.03103818 0.88249665],IDK You Yet, Alexander 23
7A2eDNBgJrEVE87C8pOMqN,[0.02190457 0.19508456 0.24347939 0.53953147],When We Were Young, Adele
4L2K7JKseFCBoHMZEAszW0,[0.06451956 0.00934866 0.02169165 0.9044401 ],Jealous, Labrinth
