song_id,mood_vec,song_name,song_artists
20on25jryn53hWghthWWW3,[0.00330226 0.53262603 0.40139705 0.06267465],Do It To It, ACRAZE Cherish
6Uj1ctrBOjOas8xZXGqKk4,[0.00308146 0.532579   0.4016671  0.06267246],Woman, Doja Cat
5dXWFMwD7I7zXsInONVl0H,[0.03680725 0.18207112 0.24039479 0.5407269 ],I Hate U, SZA
5dPz35akJjPqb17yeqNwqH,[0.00515746 0.5014168  0.39231497 0.10111077],Ghost, Justin Bieber
00Blm7zeNqgYLPtW6zg8cj,[0.00461166 0.49211535 0.41588303 0.08738992],One Right Now (with The Weeknd), Post Malone The Weeknd
3FeVmId7tL5YN8B7R3imoM,[0.00670493 0.45682162 0.41119322 0.12528029],My Universe, Coldplay BTS
1r9xUipOqoNwggBpENDsvJ,[0.00378242 0.55006105 0.3863245  0.05983205],Enemy (with JID) - from the series Arcane League of Legends, Imagine Dragons JID Arcane League of Legends
7DF8lvLdV3htIbuTWpc7lR,[0.00951767 0.4033791  0.3813556  0.20574763],Girl Of My Dreams (with SUGA of BTS), Juice WRLD SUGA BTS
4iN16F8JtVxG2UTzp3avGl,[0.00552391 0.48972327 0.41577592 0.08897689],Smokin Out The Window, Bruno Mars Anderson .Paak Silk Sonic
6PQ88X9TkUIAUIZJHW2upE,[0.00239299 0.5505834  0.3916524  0.05537119],Bad Habits, Ed Sheeran
1SOClUWhOi8vHZYMz3GluK,[0.007953   0.4339318  0.39680234 0.16131292],Infinity, Jaymes Young
3Kkjo3cT83cw09VJyrLNwX,[0.00968906 0.40298235 0.40181404 0.18551463],Oh My God, Adele
5fwSHlTEWpluwOM0Sxnh5k,[0.00457361 0.46930766 0.40742558 0.11869307],Pepas, Farruko
60wMNCIWYZwbOywZXgfQ9P,[0.0043663  0.4811797  0.4048174  0.10963658],Tears In The Club (feat. The Weeknd), FKA twigs The Weeknd
3Vi5XqYrmQgOYBajMWSvCi,[0.02064871 0.27651337 0.31435513 0.38848278],Need to Know, Doja Cat
3nOz1U41SZZ0N3fuUWr9nb,[0.00609469 0.4477962  0.40404394 0.14206515],I AM WOMAN, Emmy Meli
3uUuGVFu1V7jTQL60S1r8z,[0.03013551 0.23568559 0.2750968  0.45908204],Where Are You Now, Lost Frequencies Calum Scott
18asYwWugKjjsihZ0YvRxO,[0.0050329  0.4891918  0.41332752 0.09244772],The Motto, Tiësto Ava Max
0e8nrvls4Qqv5Rfa2UhqmO,[0.00280289 0.5613487  0.38748237 0.0483661 ],THATS WHAT I WANT, Lil Nas X
4A8cWXxKfIL3lAyUDzXbCF,[0.0112192  0.43298393 0.40762594 0.14817101],Super Gremlin, Kodak Black
6f5ExP43esnvdKPddwKXJH,[0.00465255 0.49561623 0.4146924  0.08503883],Better Days (NEIKED x Mae Muller x Polo G), NEIKED Mae Muller Polo G
0eu4C55hL6x29mmeAjytzC,[0.01525447 0.3661073  0.39170447 0.22693367],Life Goes On, Oliver Tree
32BeYxKPrig1LefHsC0Xuo,[0.00993616 0.41879907 0.38820738 0.18305744],Happier Than Ever - Edit, Billie Eilish
07MDkzWARZaLEdKxo6yArG,[0.01235452 0.3952182  0.41475105 0.17767622],Meet Me At Our Spot, THE ANXIETY WILLOW Tyler Cole
2lUDBd7JrgAMltcp6dcd7D,[0.00619553 0.46333507 0.41771188 0.11275753],25 million, Roddy Ricch
7hU3IHwjX150XLoTVmjD0q,[0.00555844 0.49086547 0.4073583  0.09621778],MONEY, LISA
748mdHapucXQri7IAO8yFK,[0.00860396 0.41087806 0.39724422 0.18327378],Kiss Me More (feat. SZA), Doja Cat SZA
5J6rTmMjF9DVIAF8G3M9n4,[0.00660522 0.45064592 0.40885544 0.1338934 ],Wandered To LA (with Justin Bieber), Juice WRLD Justin Bieber
6dmXZ9B5HdFAyzHeTneYBK,[0.04224255 0.04866423 0.08377569 0.8253175 ],LA FAMA (with The Weeknd), ROSALÍA The Weeknd
2KnLkZ3z7PO3kgVGHGqDpD,[0.06849002 0.02807924 0.05626428 0.8471665 ],It'll Be Okay, Shawn Mendes
3Wrjm47oTz2sjIgck11l5e,[0.00377983 0.51637423 0.39686158 0.08298442],Beggin', Måneskin
6w8ZPYdnGajyfPddTWdthN,[0.00612228 0.46720526 0.41685912 0.10981333],Can I Get It, Adele
6PERP62TejQjgHu81OHxgM,[0.00481598 0.48419374 0.39353335 0.11745696],good 4 u, Olivia Rodrigo
3BZEcbdtXQSo7OrvKRJ6mb,[0.00448842 0.5054157  0.3935928  0.09650312],MONTERO (Call Me By Your Name), Lil Nas X
2gQPv5jvVPqU2a9HhMNO1v,[0.01626131 0.41756955 0.33476713 0.23140204],Toxic, BoyWithUke
5enxwA8aAbwZbf5qCHORXi,[0.02041066 0.07444454 0.12219681 0.78294796],All Too Well (10 Minute Version) (Taylor's Version) (From The Vault), Taylor Swift
3eJH2nAjvNXdmPfBkALiPZ,[0.00396349 0.5175602  0.40703392 0.0714424 ],Acapulco, Jason Derulo
15HMh4yxdf4wyxSZSlOgGZ,[0.03021202 0.20418291 0.26184067 0.50376445],SAD GIRLZ LUV MONEY Remix (feat. Kali Uchis and Moliy), Amaarae Kali Uchis Moliy
2EBnvom1dTybtm75a3Xh1T,[0.04011538 0.10252612 0.15174666 0.7056119 ],feel like shit, Tate McRae
135Lf4Q0CzlMNfOxbEUsLH,[0.05230213 0.16675766 0.23197334 0.5489669 ],GHOST TOWN, Benson Boone
3QPBocWfIcOCdFFvmqn60F,[0.0198253  0.2860221  0.32435054 0.36980212],Just Look Up (From Don’t Look Up), Ariana Grande Kid Cudi
08SB2OtZkaliju77WYEKxk,[0.00446904 0.5003216  0.39764637 0.09756295],No Love (with SZA), Summer Walker SZA
2qxmye6gAegTMjLKEBoR3d,[0.03509607 0.10929524 0.15318772 0.702421  ],Let Me Down Slowly, Alec Benjamin
0bMbDctzMmTyK2j74j3nF3,[0.02907602 0.21487299 0.2655756  0.49047536],"Alone, Pt. II", Alan Walker Ava Max
5nujrmhLynf4yMoMtj8AQF,[0.00269749 0.53834987 0.3994143  0.05953838],Levitating (feat. DaBaby), Dua Lipa DaBaby
0mjAU3yKR1QnXnHtjGJqTM,[0.00452306 0.52693224 0.39555848 0.07298628],Rescue Me, OneRepublic
2RSHsoi04658QL5xgQVov3,[0.00751071 0.43285096 0.37807432 0.181564  ],Bad Liar, Imagine Dragons
3Yyj76BeYt3QIffwKpRuKL,[0.07318155 0.02291168 0.0462912  0.85761565],Arcade, Duncan Laurence
2b8fOow8UzyDFAE27YhOZM,[0.05330082 0.04303961 0.07789392 0.82576567],Memories, Maroon 5
0TK2YIli7K1leLovkQiNik,[0.00583686 0.4564867  0.42399043 0.11368607],Señorita, Shawn Mendes Camila Cabello
59qrUpoplZxbIZxk6X0Bm3,[0.00397475 0.5002335  0.41379842 0.08199333],Take You Dancing, Jason Derulo
6SRWhUJcD2YKahCwHavz3X,[0.01152945 0.3672154  0.3622571  0.25899813],Darkside, Alan Walker Au/Ra Tomine Harket
5w9c2J52mkdntKOmRLeM2m,[0.00504168 0.4839156  0.4115797  0.09946305],Con Calma, Daddy Yankee Snow
3H7ihDc1dqLriiWXwsc2po,[0.00380031 0.52205884 0.4008176  0.07332314],Breaking Me, Topic A7S
7qEHsqek33rTcFNT9PFqLf,[0.04856167 0.05300164 0.08941565 0.80902106],Someone You Loved, Lewis Capaldi
4vUmTMuQqjdnvlZmAH61Qk,[0.00770342 0.43636265 0.41488564 0.14104822],South of the Border (feat. Camila Cabello & Cardi B), Ed Sheeran Camila Cabello Cardi B
5WHTFyqSii0lmT9R21abT8,[0.01181111 0.40640327 0.37448037 0.20730527],Don't Call Me Up, Mabel
6V1bu6o1Yo5ZXnsCJU8Ovk,[0.02931555 0.16108406 0.21419522 0.5954052 ],Girls Like You (feat. Cardi B) - Cardi B Version, Maroon 5 Cardi B
3EPXxR3ImUwfayaurPi3cm,[0.03837071 0.0954681  0.14016846 0.7259927 ],Be Alright, Dean Lewis
2dpaYNEQHiRxtZbfNsse99,[0.00708835 0.44478846 0.4011446  0.1469786 ],Happier, Marshmello Bastille
3HVWdVOQ0ZA45FuZGSfvns,[0.00503457 0.4686734  0.4211712  0.10512085],I Don't Care (with Justin Bieber), Ed Sheeran Justin Bieber
5ZULALImTm80tzUbYQYM9d,[0.03616946 0.14049073 0.19047892 0.63286084],Dance Monkey, Tones And I
2rRJrJEo19S2J82BDsQ3F7,[0.01741675 0.33770165 0.3764674  0.26841414],Falling, Trevor Daniel
0n2nEtLP3OzDdi12ziIekx,[0.0165066  0.35651806 0.372747   0.25422832],SOS, Avicii Aloe Blacc
4w8niZpiMy6qz1mntFA5uM,[0.00339413 0.5258853  0.40278655 0.06793397],"Taki Taki (with Selena Gomez, Ozuna & Cardi B)", DJ Snake Selena Gomez Ozuna Cardi B
5CLGzJsGqhCEECcpnFQA8x,[0.00921433 0.4225431  0.39537963 0.17286289],"These Days (feat. Jess Glynne, Macklemore & Dan Caplen)", Rudimental Jess Glynne Macklemore Dan Caplen
2VxeLyX666F8uXCJ0dZF8B,[0.03548918 0.16881956 0.22949617 0.56619513],Shallow, Lady Gaga Bradley Cooper
63SevszngYpZOwf63o61K4,[0.0090762  0.4816991  0.39247265 0.11675207],Nevermind, Dennis Lloyd
1xQ6trAsedVPCdbtDAmk0c,[0.00693684 0.44877484 0.40671074 0.13757761],Savage Love (Laxed - Siren Beat), Jawsh 685 Jason Derulo
4evmHXcjt3bTUHD1cvny97,[0.00674362 0.46754187 0.41389555 0.11181895],Beautiful People (feat. Khalid), Ed Sheeran Khalid
1InCpEliLCkWHOBdXW7XSx,[0.00505033 0.4864277  0.41203266 0.09648928],Kings & Queens, Ava Max
2gMXnyrvIjhVBUZwvLZDMP,[0.04133036 0.08818687 0.13081019 0.73967254],Before You Go, Lewis Capaldi
1sgDyuLooyvEML4oHspNza,[0.01735337 0.28908277 0.32699022 0.3665737 ],Lose Somebody, Kygo OneRepublic
6LsAAHotRLMOHfCsSfYCsz,[0.01287218 0.3493837  0.35167372 0.28607044],If I Can't Have You, Shawn Mendes
0DiDStADDVh3SvAsoJAFMk,[0.00704641 0.44157773 0.4254809  0.125895  ],Only Human, Jonas Brothers
1DFD5Fotzgn6yYXkYsKiGs,[0.0048612  0.49069783 0.4160928  0.08834819],Piece Of Your Heart, MEDUZA Goodboys
2Fxmhks0bxGSBdJ92vM42m,[0.01404854 0.43401253 0.40924448 0.1426945 ],bad guy, Billie Eilish
6fRxMU4LWwyaSSowV441IU,[0.00545227 0.4662784  0.41957167 0.10869759],Beautiful Mistakes (feat. Megan Thee Stallion), Maroon 5 Megan Thee Stallion
2Z8yfpFX0ZMavHkcIeHiO1,[0.00902975 0.4052969  0.40957457 0.17609872],Monster (Shawn Mendes & Justin Bieber), Shawn Mendes Justin Bieber
3ZCTVFBt2Brf31RLEnCkWJ,[0.6355403  0.00640624 0.01394281 0.34411058],everything i wanted, Billie Eilish
7CHi4DtfK4heMlQaudCuHK,[0.01129616 0.39722595 0.40181723 0.18966076],Lose Control, MEDUZA Becky Hill Goodboys
4jPy3l0RUwlUI9T5XHBW2m,[0.00642361 0.48195368 0.40798855 0.10363416],Mood (feat. iann dior), 24kGoldn iann dior
14msK75pk3pA33pzPVNtBF,[0.0509753  0.19643718 0.25873068 0.4938568 ],7 rings, Ariana Grande
7Feaw9WAEREY0DUOSXJLOM,[0.01203428 0.4029407  0.3901674  0.19485757],Summer Days (feat. Macklemore & Patrick Stump of Fall Out Boy), Martin Garrix Macklemore Fall Out Boy
7eJMfftS33KTjuF7lTsMCx,[0.0472635  0.22035725 0.24779187 0.48458734],death bed (coffee for your head), Powfu beabadoobee
62aP9fBQKYKxi7PDXwcUAS,[0.00503607 0.5147883  0.39915782 0.08101781],ily (i love you baby) (feat. Emilee), Surf Mesa Emilee
2tnVG71enUj33Ic2nFN6kZ,[0.00360099 0.5145612  0.40882283 0.073015  ],Ride It, Regard
4y3OI86AEP6PQoDE6olYhO,[0.00224945 0.55061764 0.39386803 0.05326488],Sucker, Jonas Brothers
7hxHWCCAIIxFLCzvDgnQHX,[0.00968694 0.4028424  0.38733077 0.20013995],"Lemonade (feat. Gunna, Don Toliver & NAV)", Internet Money Gunna Don Toliver NAV
6kls8cSlUyHW2BUOkDJIZE,[0.00632142 0.46926728 0.41692865 0.1074826 ],Hate Me (with Juice WRLD), Ellie Goulding Juice WRLD
5NyS3oxTlos3Agl2YtZwrC,[0.00248863 0.5683169  0.38395527 0.04523919],RITMO (Bad Boys For Life), Black Eyed Peas J Balvin
7ytR5pFWmSjzHJIeQkgog4,[0.01049824 0.4245149  0.40040958 0.16457728],ROCKSTAR (feat. Roddy Ricch), DaBaby Roddy Ricch
6ft4hAq6yde8jPZY2i5zLr,[0.00826889 0.4430168  0.4094204  0.13929391],Paradise (feat. Dermot Kennedy), MEDUZA Dermot Kennedy
6UelLqGlWMcVH1E5c4H7lY,[0.00599679 0.48998708 0.4018313  0.10218485],Watermelon Sugar, Harry Styles
6Pgkp4qUoTmJIPn7ReaGxL,[0.00482106 0.4912587  0.40769008 0.09623019],Without You (feat. Sandro Cavazza), Avicii Sandro Cavazza
18uwL0vNUanqZH0ro2QcOP,[0.04535021 0.159497   0.21575382 0.57939893],comethru, Jeremy Zucker
0CcQNd8CINkwQfe1RDtGV6,[0.00257683 0.5415559  0.39801225 0.05785505],Believer, Imagine Dragons
1SNiXDwSilLujcYdvfqVpT,[0.01087196 0.40904215 0.3821429  0.19794294],Call You Mine, The Chainsmokers Bebe Rexha
696DnlkuDOXcMAnKlTgXXK,[0.0036939  0.5395456  0.39541385 0.06134661],ROXANNE, Arizona Zervas
0E9ZjEAyAwOXZ7wJC0PD33,[0.00841146 0.44692287 0.39105767 0.15360802],In My Mind, Dynoro Gigi D'Agostino
0GzuHFG4Ql6DoyxFRnIk3F,[0.00089686 0.62070185 0.35241607 0.02598524],Hawái - Remix, Maluma The Weeknd
0EhpEsp4L0oRGM0vmeaN5e,[0.0042962  0.4876619  0.4059837  0.10205825],UN DIA (ONE DAY) (Feat. Tainy), J Balvin Dua Lipa Bad Bunny Tainy
0nbXyq5TXYPCO7pr3N8S4I,[0.00305106 0.5547342  0.38863754 0.05357721],The Box, Roddy Ricch
7apizLyhMRutg3ccXvr2qv,[0.00725904 0.47681823 0.38958892 0.12633383],Hurt Somebody, Noah Kahan Julia Michaels
3Ol2xnObFdKV9pmRD2t9x8,[0.02336135 0.2697864  0.3162755  0.39057678],Look Back at It, A Boogie Wit da Hoodie
285pBltuF7vW8TeWk8hdRR,[0.02157162 0.31180695 0.32765818 0.3389633 ],Lucid Dreams, Juice WRLD
4SPLWgCPoKwULz2UTM8TKg,[0.01314586 0.35588616 0.3641726  0.26679546],Symphony (feat. Zara Larsson), Clean Bandit Zara Larsson
7fBv7CLKzipRk6EC6TWHOB,[0.01516326 0.34258145 0.3686941  0.27356115],The Hills, The Weeknd
7JJmb5XwzOO8jgpou264Ml,[0.00691939 0.43268    0.39782533 0.16257522],There's Nothing Holdin' Me Back, Shawn Mendes
6xTU6B6nFwKKTSZ9ySXS80,[0.01577611 0.34569165 0.37245303 0.26607922],Remind Me to Forget, Kygo Miguel
5Fla3zyOCcIRqrDoKLU0DP,[0.00614847 0.48864245 0.39087272 0.11433639],Let You Love Me, Rita Ora
14JzyD6FlBD5z0wV5P07YI,[0.13392343 0.01052956 0.02450326 0.8310438 ],when the party's over, Billie Eilish
26EZZ0xthDGAainMj2L0bR,[0.02200405 0.24507822 0.29931197 0.43360585],You & I - Radio Edit, One Direction
514rhnksEwHUh6LxXsQ4Y9,[0.00941743 0.41602916 0.4039622  0.17059119],Back To You, Selena Gomez
3cNjgVBKTJ1SvKhunrCdVy,[0.00819247 0.45810413 0.402155   0.13154837],Please Don't Go, Joel Adams
5icOoE6VgqFKohjWWNp0Ac,[0.01254273 0.4000716  0.39749908 0.18988669],Here With Me, Marshmello CHVRCHES
4r1CoAATVuxag55Ct3Y1aX,[0.00526444 0.49210748 0.40536958 0.09725853],I'll Be There, Jess Glynne
3RiPr603aXAoi4GHyXx0uy,[0.01527889 0.3474959  0.35941944 0.2778058 ],Hymn for the Weekend, Coldplay
0tgVpDi06FyKpA1z0VMD4v,[0.0266346  0.21936563 0.28464246 0.46935728],Perfect, Ed Sheeran
1HxLdPHNJbFY3DG8c5qqhX,[0.02313482 0.31447086 0.323077   0.33931735],bellyache, Billie Eilish
5OCJzvD7sykQEKHH7qAC3C,[0.00602744 0.47108796 0.40281272 0.12007183],God is a woman, Ariana Grande
6gBFPUFcJLzWGx4lenP6h2,[0.00552626 0.46058658 0.40377393 0.13011317],goosebumps, Travis Scott
3y3brCCecHC3Db18aIOnny,[0.02133468 0.27203798 0.3046303  0.40199703],"Carry On (from the Original Motion Picture ""POKÉMON Detective Pikachu"")", Kygo Rita Ora
0qOnSQQF0yzuPWsXrQ9paz,[0.00279686 0.5450637  0.39601803 0.05612142],Stereo Hearts (feat. Adam Levine), Gym Class Heroes Adam Levine
3erAiWBiKsbVG39cqCrsI0,[0.01161365 0.413759   0.37865236 0.19597498],Human, Rag'n'Bone Man
7hDVYcQq6MxkdJGweuCtl9,[0.0555925  0.02824664 0.05284034 0.86332047],ocean eyes, Billie Eilish
06KyNuuMOX1ROXRhj787tj,[0.03620429 0.15774393 0.2066742  0.5993776 ],We Don't Talk Anymore (feat. Selena Gomez), Charlie Puth Selena Gomez
5WtfUKzXircvW8l5aaVZWT,[0.04147894 0.08661731 0.13153982 0.74036396],What A Time (feat. Niall Horan), Julia Michaels Niall Horan
2T3jgoAMbBXiMMD8pSc6QL,[0.00782267 0.43675345 0.4048716  0.15055224],This Is The Life, Amy Macdonald
2G7V7zsVDxg1yRsu7Ew9RJ,[0.00570178 0.49467993 0.40515244 0.09446596],In My Feelings, Drake
4OafepJy2teCjYJbvFE60J,[0.00842072 0.44143558 0.40757582 0.14256793],breathin, Ariana Grande
1dNIEtp7AY3oDAKCGg2XkH,[0.00781531 0.43033713 0.40980184 0.15204579],Something Just Like This, The Chainsmokers Coldplay
6T689Jvh5KrSXyaPtUWZtQ,[0.00459657 0.4848161  0.4150628  0.09552451],Criminal, Britney Spears
3zoYkqS4y2BsGVShPL2nTE,[0.00491113 0.4960172  0.40401202 0.09505969],Reggaetón Lento (Remix), CNCO Little Mix
09mEdoA6zrmBPgTEN5qXmN,[0.01478286 0.34206238 0.3495056  0.2936491 ],Call Out My Name, The Weeknd
58q2HKrzhC3ozto2nDdN4z,[0.00233111 0.54788643 0.39115798 0.05862444],I Like It, Cardi B Bad Bunny J Balvin
3B7NxfpWANGqBq91suV8ss,[0.0013754  0.6011005  0.3651768  0.03234725],Don't Be so Shy - Filatov & Karas Remix, Imany
30BsewEJZPxfuLNAlZPFje,[0.04603606 0.02596027 0.04978934 0.8782143 ],"Read All About It, Pt. III", Emeli Sandé
5kqIPrATaCc2LqxVWzQGbk,[0.01736066 0.3147992  0.33753252 0.33030763],7 Years, Lukas Graham
2hgzdQdnfWwtdpZbhZlV72,[0.00204012 0.56421137 0.38682917 0.04691929],Ain't Your Mama, Jennifer Lopez
2tpWsVSb9UEmDRxAl1zhX1,[0.00687087 0.43289652 0.40387914 0.15635343],Counting Stars, OneRepublic
1zB4vmk8tFRmM9UULNzbLB,[0.00452708 0.48755297 0.3959726  0.11194733],Thunder, Imagine Dragons
2IRZnDFmlqMuOrYOLnZZyc,[0.01456246 0.3755881  0.38720357 0.22264588],Going Bad (feat. Drake), Meek Mill Drake
5uCax9HTNlzGybIStD3vDh,[0.04784396 0.07314766 0.11619709 0.7628113 ],Say You Won't Let Go, James Arthur
2toVe5hfuIi97ytDPDbQFt,[0.0059976  0.4704775  0.41535473 0.10817023],Taste (feat. Offset), Tyga Offset
5pDUMdIiW0rNLzFryqpC9j,[0.0081184  0.43484172 0.40997487 0.14706494],Diamonds, Rihanna
7x5xYW5W42OGPAdHUyyguy,[0.01547631 0.31540337 0.34568718 0.32343325],Locked Away (feat. Adam Levine), R. City Adam Levine
1CnPYaKxTVb4LWOtiGOm0m,[0.00924505 0.41487145 0.40819263 0.16769086],All Time Low, Jon Bellion
0CokSRCu5hZgPxcZBaEzVE,[0.00468112 0.48516288 0.4058672  0.10428883],Glorious (feat. Skylar Grey), Macklemore Skylar Grey
2j5hsQvApottzvTn4pFJWF,[0.00866633 0.4243076  0.4081048  0.15892126],What Lovers Do (feat. SZA), Maroon 5 SZA
2eAvDnpXP5W0cVtiI0PUxV,[0.0067021  0.43879145 0.40766266 0.14684372],Dandelions, Ruth B.
1m84zLz4WizjR4mCDoXReg,[0.04744259 0.0449096  0.08091508 0.8267328 ],I Don't Care - Acoustic, Ed Sheeran
1iQDltZqI7BXnHrFy4Qo1k,[0.03352974 0.14721216 0.20157626 0.6176818 ],Trampoline (with ZAYN), SHAED ZAYN
6wo37KVqFJhtuxPTpLCcfe,[0.02329563 0.28478348 0.3417083  0.35021257],Takeaway (feat. Lennon Stella), The Chainsmokers ILLENIUM Lennon Stella
2K0r5GD5zYlEMx2M7ZMcqG,[0.0168592  0.3764864  0.37126616 0.23538831],Better Days, OneRepublic
3cMAS9DjZHrAnKvPrTIw7Z,[0.01615188 0.31627792 0.3327926  0.33477756],Wait for You (feat. Zoe Wees), Tom Walker Zoe Wees
44l9nnCVvOQBbWG6tDViKl,[0.0035024  0.5044005  0.40762192 0.08447515],Share That Love (feat. G-Eazy), Lukas Graham G-Eazy
4X1r74w09Ok0KgHSziwVWA,[0.01357218 0.3927627  0.37911227 0.21455282],Room For Love, Lord Siva Vera
18XlJEroUwFo0tLZxscgXE,[0.00397814 0.50348204 0.40662488 0.08591495],Lost, Maroon 5
2U12JbtnFSYa5Av5wEcEDX,[0.02641877 0.17975533 0.22678265 0.5670433 ],Oh My God, Alec Benjamin
3wJVBz7gvGTwTWVAxFa6ny,[0.00409021 0.5228448  0.4048872  0.06817774],Fever, Dua Lipa Angèle
7ce20yLkzuXXLUhzIDoZih,[0.04133036 0.08818687 0.13081019 0.73967254],Before You Go, Lewis Capaldi
1PZG9IBZMCY6HdK2v8kSYo,[0.02654748 0.18310857 0.24089308 0.5494509 ],If That's Alright, Dylan Dunlap
27NaNvlmvOHqTF0VPjuRSD,[0.01203467 0.39766747 0.4002702  0.19002777],Lie, Lukas Graham
72PFP54TZ9Tpj9dYQcb46D,[0.00290939 0.52715874 0.404307   0.06562495],NIGHTRIDER, Arizona Zervas
3lKmH9D42U7Rqq6chJUUBh,[0.03015973 0.26022837 0.3087474  0.40086448],Closer to You, Rasmus Hagen Nora Andersson
7LYGpt7ckc34CFWcsxwnJl,[0.04090156 0.10990725 0.15825607 0.6909352 ],Ripples, Maximillian
43Hit5V2BpPq2vxvca3ysc,[0.01050435 0.38946062 0.37924474 0.22079027],Lean On Me, Sandro Cavazza
3kwgqoBqTwoAH4nT29TYrq,[0.03383941 0.18867652 0.24744816 0.53003585],Nobody's Love, Maroon 5
58wyJLv6yH1La9NIZPl3ne,[0.16351604 0.01077854 0.02636681 0.7993385 ],Can We Kiss Forever?, Kina Adriana Proenza
2KoHxhRyWxJzA0VafWd5Nk,[0.03375508 0.15120389 0.204945   0.61009604],My Oasis (feat. Burna Boy), Sam Smith Burna Boy
4P6IttK2PRBjyr3fm0pP7t,[0.0169943  0.35358208 0.37936106 0.25006253],Past Life (with Selena Gomez), Trevor Daniel Selena Gomez
5rWjy4ys7LdinaFKZQBlZh,[0.01146753 0.342894   0.36110148 0.28453708],Be Your Man, Rhys Lewis
6Ldq5GpaIafEi67Cuh2h3X,[0.0287236  0.27624485 0.32670873 0.36832285],Still Alive, Maximillian
1e6McS5TlhjM3NRJMLfYPr,[0.01172825 0.38475767 0.3998848  0.20362929],Crying My Eyes Out, Stephen Puth
22AJMMJMaQ3qtTwlegrKcm,[0.05180736 0.04471717 0.07789434 0.8255811 ],Six Feet Apart, Alec Benjamin
1HimGOB6BjOaCQYMIF1xtU,[0.00591498 0.45834613 0.4027354  0.13300347],What Am I, Why Don't We
3Z8FwOEN59mRMxDCtb8N0A,[0.00892438 0.43310606 0.41911396 0.13885562],Be Kind (with Halsey), Marshmello Halsey
68z9t6zihQgqzBGtexjTRG,[0.02208391 0.23619832 0.27502292 0.4666949 ],Happy For You, Lukas Graham
7aGyRfJWtLqgJaZoG9lJhE,[0.01093555 0.4414967  0.38057694 0.16699079],Mad at Disney, salem ilese
3bveGlyB1hTt9g2qqkR0jl,[0.0478624  0.0469267  0.08116555 0.82404536],Lifeline, Tómas Welding ELVA
5bZeugrr7oIATt1CLJuhT4,[0.01471491 0.2899414  0.31430402 0.38103965],Incredible, James TW
6TbkMxKZudkP6Sty7rkLU9,[0.04856994 0.06065048 0.10098366 0.78979594],Perfectly Imperfect, Declan J Donovan
55Am8neGJkdj2ADaM3aw5H,[0.05708986 0.03692441 0.06673121 0.8392545 ],Train Wreck, James Arthur
2kJwzbxV2ppxnQoYw4GLBZ,[0.05517027 0.05258395 0.08900011 0.80324566],If the World Was Ending (feat. Julia Michaels), JP Saxe Julia Michaels
5mpCx2nbXtAbnzd342Mwrb,[0.05851339 0.03872533 0.06991839 0.8328428 ],I Do, Aloe Blacc
45bE4HXI0AwGZXfZtMp8JR,[0.07004575 0.03624977 0.06656291 0.8271415 ],you broke me first, Tate McRae
3xvYvJAa0iUVKKsYcuDNlK,[0.00498227 0.493457   0.40623936 0.09532133],Hard On Yourself, Charlie Puth blackbear
0E4Y1XIbs8GrAT1YqVy6dq,[0.05044822 0.06547686 0.10379923 0.78027576],Afterglow, Ed Sheeran
3H3r2nKWa3Yk5gt8xgmsEt,[0.05447821 0.05161831 0.09080447 0.803099  ],This City, Sam Fischer
0NbDnRbBxUaT27CTgmraSG,[0.04809524 0.06517067 0.10576627 0.7809677 ],Black Converse, LOVA
5FNS5Vj69AhRGJWjhrAd01,[0.01879904 0.29830676 0.3454112  0.33748305],Slow Dance (feat. Ava Max), AJ Mitchell Ava Max
53JYK65bbkGTKB9QBi1eWL,[0.04705776 0.08527852 0.13989687 0.7277669 ],Let Him Go, JUNG Clara Mae
7ybTXgmWoVFV33te4kVlUR,[0.0059521  0.4862049  0.3748049  0.13303813],Run Through Walls, The Script
5z8uLrYMcUVvzTV28twt44,[0.00605103 0.44836438 0.41117495 0.13440962],Slow Grenade, Ellie Goulding Lauv
4HBZA5flZLE435QTztThqH,[0.00854655 0.40136608 0.37843424 0.21165316],Stuck with U (with Justin Bieber), Ariana Grande Justin Bieber
0ClPIeT6MSgfSgQ9ZrJbAq,[0.00635334 0.44967344 0.42206204 0.1219111 ],Cheating on You, Charlie Puth
1hCTxutVVYvggAQcUUUZAT,[0.04682737 0.05545102 0.09271415 0.8050075 ],Put A Little Love On Me, Niall Horan
4iJyoBOLtHqaGxP12qzhQI,[0.0122037  0.41312918 0.3784177  0.1962494 ],Peaches (feat. Daniel Caesar & Giveon), Justin Bieber Daniel Caesar Giveon
1HfMVBKM75vxSfsQ5VefZ5,[0.0550636  0.06192445 0.10248337 0.7805286 ],Lose You To Love Me, Selena Gomez
2NWVdwbd2hPIzC2lyf4y63,[0.04215893 0.12080745 0.17449358 0.66254   ],Moral of the Story (feat. Niall Horan), Ashe Niall Horan
5rZlwNFl01HqLWBQGryKSm,[0.01668419 0.4039321  0.37059757 0.20878614],Mood Swings (feat. Lil Tjay), Pop Smoke Lil Tjay
0ND8rF8oirMXtE59n585P6,[0.03545519 0.1760731  0.23809889 0.55037284],17, Julia Michaels
4k3uABcX9iaGlt5pRJhumi,[0.01311732 0.39423245 0.3964813  0.1961689 ],stupid, Tate McRae
364dI1bYnvamSnBJ8JcNzN,[0.00882365 0.38972095 0.3907844  0.21067092],Intentions, Justin Bieber Quavo
7igeByaBM0MgGsgXtNxDJ7,[0.01117447 0.3776003  0.36381665 0.24740854],positions, Ariana Grande
2CdTLdDjwZdVcm0bresVWx,[0.00887602 0.43132478 0.4074468  0.15235232],Otra Noche Sin Ti, J Balvin Khalid
0lx2cLdOt3piJbcaXIV74f,[0.0490855  0.07845943 0.11843881 0.75401616],willow, Taylor Swift
2wrJq5XKLnmhRXHIAf9xBa,[0.01466023 0.36849472 0.38640082 0.23044418],"10,000 Hours (with Justin Bieber)", Dan + Shay Justin Bieber
0cppqb4vQycORHNMxr8DGd,[0.04603507 0.04406475 0.07451289 0.8353873 ],Favorite Part Of Me, Astrid S
0GlO3iD7ParRcxXPRz6o04,[0.06330069 0.04502236 0.08069532 0.81098163],Back To You, Jake Cornell
67GvvBfumjbeuMzhXVgn02,[0.00660125 0.46129164 0.39919794 0.13290913],Too Close, JP Cooper
2URXzpbSUwOjltvpgtzXua,[0.0435783  0.10140681 0.15922791 0.69578695],You Will Be Found (with Summer Walker) - From The “Dear Evan Hansen” Original Motion Picture Soundtrack, Sam Smith Summer Walker
5u1n1kITHCxxp8twBcZxWy,[0.00524593 0.50836575 0.40066794 0.08572038],Holy (feat. Chance The Rapper), Justin Bieber Chance the Rapper
0VsGaRXR5WAzpu51unJTis,[0.05964952 0.02639628 0.05111118 0.862843  ],Best Part of Me (feat. YEBBA), Ed Sheeran Yebba
0ri0Han4IRJhzvERHOZTMr,[0.04723189 0.07940708 0.12657413 0.7467869 ],At My Worst, Pink Sweat$
1MGGLyAMVQo3T9gSEBJjyH,[0.03307309 0.18610772 0.24805804 0.5327611 ],Gone Are The Days (feat. James Gillespie), Kygo James Gillespie
4VEEDnEFLI9dUy5QA51rom,[0.01450403 0.40660572 0.37493894 0.20395125],fools (can't help falling in love) (feat. Sody), Foster Sody Sarcastic Sounds
18o9PF85OEi7Vrfdfdi5sH,[0.00296401 0.51580584 0.4071081  0.07412211],What Happened to Us, Isaiah Firebrace
2ZTYlnhhV1UAReg7wIGolx,[0.05053472 0.04796685 0.07939491 0.82210344],To Die For, Sam Smith
4f9IfFvBFm7Gsf1IVEudyf,[0.01667077 0.39161295 0.3986364  0.19307989],lie to me, Tate McRae Ali Gatie
1EHUQesfVKwbthtNcpBi9g,[0.01943907 0.32199198 0.36924538 0.28932354],WITHOUT YOU (with Miley Cyrus), The Kid LAROI Miley Cyrus
2GjQ5KNXggsIRpx5ZUj2zX,[0.05139641 0.03089268 0.05625458 0.8614563 ],Her, Anne-Marie
5ovVcYo2MvjVydFwFyaaqy,[0.045776   0.07536802 0.12126614 0.7575898 ],I Should Probably Go To Bed, Dan + Shay
1cEhrSF6EylAEqdhUGuNpX,[0.00736072 0.4504951  0.40928993 0.13285418],LET IT GO (feat. Justin Bieber & 21 Savage), DJ Khaled 21 Savage Justin Bieber
4pvb0WLRcMtbPGmtejJJ6y,[0.05688325 0.01474109 0.03153327 0.89684236],exile (feat. Bon Iver), Taylor Swift Bon Iver
2h9TDNEXRhcDIV3fsoEVq9,[0.01848464 0.31322935 0.35418475 0.31410134],What Other People Say, Sam Fischer Demi Lovato
6oaQuXiRKqQq9ITJBV1XmC,[0.01139296 0.38744125 0.38280833 0.2183575 ],Wild Life, OneRepublic
6isTQfKXhNO3EyJd9mSxx8,[0.05757684 0.05310421 0.08618845 0.8031305 ],AM I DREAMING (feat. Miley Cyrus), Lil Nas X Miley Cyrus
6aXgxeYA03veaPyHHZQaj3,[0.03580291 0.18921961 0.25027296 0.52470446],Until We Meet Again, Nick Jonas
55vsJO4tLZQ37qzD5QUOmh,[0.05038661 0.03762586 0.0679353  0.8440523 ],House With No Mirrors, Sasha Alex Sloan
27Y1N4Q4U3EfDU5Ubw8ws2,[0.09235526 0.0182286  0.0386773  0.8507388 ],What They'll Say About Us, FINNEAS
44V6EzbUSYgyfsNiP0FrlA,[0.04219534 0.03950809 0.06848451 0.849812  ],Visiting Hours, Ed Sheeran
6wpdCYRRzFtBT7HzdEqgK9,[0.05955796 0.05595293 0.09605499 0.78843415],Down, Jack Curley
312zSwwbPU7C3sTmro4Wx9,[0.04033884 0.24734654 0.29303998 0.4192746 ],It's Ok If You Forget Me, Astrid S
5aXfGM7WVcqyAvqnL7k0y3,[0.04901802 0.06086013 0.09957436 0.7905475 ],Remember - Acoustic, Becky Hill
0Cs31CzQp6peDLWVCK0app,[0.05633245 0.02567773 0.04953619 0.8684535 ],Ocean, Lady A
4SHJLxcRicQyT42jG95Y5u,[0.03612494 0.07838247 0.12073488 0.76475775],No Right To Love You, Rhys Lewis
5qNh5WtzMbfpSj2jLlBkoD,[0.0719712  0.02042526 0.04123041 0.8663732 ],Your Power, Billie Eilish
19pChrR4hwdINqoOFUo2Hj,[0.09855549 0.04007594 0.07456137 0.7868072 ],Keep Your Head Up Princess, Anson Seabra
1Ia95g66IhlAJ3qVI4qI8W,[0.07228492 0.03345078 0.06352779 0.8307365 ],Slow, SHY Martin
0Kjkp9SLw8uhBAiSrSgdcB,[0.04761277 0.06553791 0.112341   0.7745083 ],Forever Young, Boy In Space
2tSDwInMbSGmUySTeUgO5e,[0.01882102 0.34567243 0.3766841  0.25882244],Love Like That, Lauv
